0,1
0,a dog laying on a rug in a room
1,a bird sitting on a rock in a forest
2,a bottle of water sitting on a table
3,a large body of water with a sky background
4,a black and white bird is standing in the grass
5,a small bird sitting on top of a fire hydrant
6,a white bird flying over a green field
7,a couple of sheep standing on top of a grass covered field
8,a woman sitting at a table in a restaurant
9,a wooden table with a tray of food on it
10,a couple of birds sitting on a tree branch
11,a very tall building with a clock on its side
12,a brown horse standing next to a wooden fence
13,a sheep grazing in a field of grass
14,a group of people on a surfboard in the water
15,a bed with a black and white bedspread
16,a brown and white cow standing on a lush green hillside
17,a wooden table with two wooden chairs
18,a couple of people riding on the back of a horse drawn carriage
19,a living room filled with furniture and a lamp
20,a cat that is sitting on a table
21,a train is parked at a train station
22,a red chair with a laptop sitting on it
23,a black and white cat is sitting on a bench
24,a boat in the middle of a lake
25,a small white dog is sitting on a bed
26,a brown cow eating grass in a field
27,a black cat laying down on a couch
28,a couple of pieces of furniture in a room
29,a black and white photo of a train on a track
30,a close up of a cow in a field
31,a green room with a green light on the wall
32,a black and silver motorcycle parked in a parking lot
33,a train traveling down train tracks next to a field
34,a small white dog standing in a field
35,a school bus parked in a parking lot
36,a dog laying on a rug next to a wooden chair
37,a brown horse standing next to a brown horse
38,a cat that is laying down on a blanket
39,a couple of kites flying in a cloudy sky
40,a close up of a bird with a face
41,a black and white cat laying on a blanket
42,a brick building with a clock on the side
43,a sheep is grazing in the grass behind a fence
44,a cat sitting on a bench looking out the window
45,a black and white bird sitting on a branch
46,a dog is sleeping on a red blanket
47,a small plane is sitting on a runway
48,a large air plane on a run way
49,a man and a woman standing next to each other
50,a laptop computer sitting on top of a desk
51,a small toy car sits on top of a toy car
52,a man and a woman are petting a horse
53,a black and white photo of a street sign
54,a model of a model of a model airplane
55,a group of boats sitting in a warehouse
56,a bed with a blanket on it and a blanket
57,a cat is sleeping on a red shoe
58,a close up of a horse in a field
59,a motorcycle parked in front of a building
60,a large air plane flying in the air
61,a large bird is standing on a table
62,a woman sitting at a table with a cake
63,a truck parked in a parking lot next to a field
64,a group of buses parked in front of a building
65,a large jetliner sitting on top of an airport runway
66,a living room with a couch a chair and a table
67,two black cows eating grass in a field
68,a couple of snow skiers are in the snow
69,a black and white cow eating grass in a field
70,a cat is looking out of a window
71,a large air plane on a run way
72,a man holding a bottle of wine and a bottle
73,a television is sitting on a wooden table
74,a black and white cat laying on its back
75,a cow is standing in front of a building
76,a view of a forest with trees in the background
77,a train traveling down train tracks next to a forest
78,a man sitting on a bench next to a woman
79,a city street with cars parked on the side
80,a young boy is playing a video game
81,a train traveling down train tracks next to another train
82,a white seagull flying over a body of water
83,a close up of a orange and black background
84,a man riding on the back of a brown horse
85,a man and a woman holding wine glasses
86,a person riding a white horse in a field
87,a wooden bench sitting next to a tree
88,a bicycle is parked next to a wall
89,a couple of horses standing on top of a grass covered field
90,a group of people sitting at a table
91,a couple of dogs laying on a bed
92,a bicycle is parked next to a building
93,a cat is sleeping on a red carpet
94,a man riding a bike down a street
95,a bike parked in a parking lot next to a building
96,a person riding a motorcycle on a track
97,a black cow standing in a field of grass
98,a small bird sitting on a tree branch
99,a train that is sitting on a rail
100,a double decker bus parked on a beach
101,a silver car parked in a parking lot
102,a person riding a motorcycle on a track
103,a dog sitting in the drivers seat of a car
104,a red train is traveling down the tracks
105,a couple of horses standing next to each other
106,a man standing on top of a small plane
107,a young boy sitting in a car with a camera
108,a green double decker bus parked in a lot
109,a vase of flowers sitting on a window sill
110,a man riding a wave on top of a surfboard
111,a couple of people standing next to each other
112,a double decker bus driving down a street
113,a window is shown in a window
114,a large brick building with a large building in the background
115,a cat that is laying down on a couch
116,a living room with a red couch and book shelf
117,a person on a bike with a basket
118,a train traveling down train tracks near a field
119,a white refrigerator freezer sitting inside of a kitchen
120,a white teddy bear sitting on top of a couch
121,a red double decker bus parked in a lot
122,a car parked next to a parking meter
123,a close up of a small bird in a field
124,a sunset with a sky in the background
125,a microwave oven sitting on top of a counter
126,a double decker bus parked in front of a building
127,a close up of a cell phone with a message on it
128,a black and white cow standing next to a wooden fence
129,a white bird flying in the blue sky
130,an airplane flying in the air with a sky background
131,a woman is talking on a cell phone
132,a glass of wine sitting next to a glass
133,a group of people walking down a sidewalk
134,a vase with a flower in it sitting on a table
135,a red motorcycle parked on the side of a road
136,a motorcycle parked on the side of a street
137,a brown horse standing next to a fence
138,a group of people sitting in a living room
139,a cat that is sitting in front of a mirror
140,a man riding a skateboard down a street
141,a red and white fire hydrant in the grass
142,a group of people sitting on top of a boat
143,a bus is parked on the side of the street
144,a cat is sleeping on a chair
145,a man standing next to a man on a street
146,a blue bus parked in a parking lot
147,a large jetliner flying through a cloudy sky
148,a store with a variety of items on display
149,a bike with a basket on top
150,a train traveling down train tracks next to a building
151,a blue and yellow bus driving down a street
152,a bunch of potted plants sitting on a counter
153,a living room with furniture and a painting on the wall
154,a close up of a cloudy sky on a cloudy day
155,a boat floating on top of a body of water
156,a double decker bus parked in a parking lot
157,a group of people sitting at a table
158,a potted plant is sitting in a planter
159,a woman sitting on a chair holding a wii remote
160,a man riding on the back of a motorcycle
161,a bike parked next to a tree in a park
162,a brown dog standing on top of a dirt field
163,a woman sitting on a curb with a cell phone
164,a man is looking at a glass of wine
165,a woman standing in a field with a cell phone
166,a street sign on a pole on a street
167,a woman laying on a couch with a cat
168,a white and blue plane is taking off
169,a herd of cattle standing on top of a dirt road
170,a small white dog laying on top of a blanket
171,a large white bird with a long beak
172,a yellow and black car parked on a street
173,a train that is sitting on the tracks
174,a red car parked in a parking lot
175,a person with a black shirt and a black backpack
176,a dining room table with a chair and a table
177,a cat sitting on a chair in a room
178,a boat that is sitting in the water
179,a black and white photo of a bus
180,a living room filled with furniture and a book shelf
181,a couple of animals that are laying down in the grass
182,a living room with a tv and a fireplace
183,a yellow and black bird perched on a branch
184,a large propeller plane sitting inside of a building
185,two baby lambs are laying in the grass
186,a black bear standing on top of a rock
187,a white dog with a blue sweater on its head
188,a herd of sheep standing on top of a grass covered field
189,a horse that is standing in the dirt
190,a white and red bus driving down a street
191,a woman standing next to a brown and white cow
192,a man riding a motorcycle down a street
193,a couple of sheep standing on top of a lush green hillside
194,a large body of water with a mountain in the background
195,a tall clock tower towering over a city
196,a yellow and black model car on display
197,a group of buses parked in a lot
198,a man and a dog on a small boat
199,a large passenger jet flying through a blue sky
200,a woman is standing in a train car
201,a baby sleeping on a bed with a cat
202,a young girl holding a toothbrush in her mouth
203,a cat sitting on a bed in a room
204,a flock of birds flying over a body of water
205,a woman and a dog are on a bed
206,a red and yellow train traveling down train tracks
207,a gray and white bird sitting on a branch
208,a dog is standing in the snow with a frisbee
209,a couple of sheep standing next to each other
210,a dog is standing on a dirt ground
211,a small plane is sitting on a runway
212,a horse is eating grass in a field
213,a bike parked in front of a building
214,a dog sitting on a couch with a blanket
215,a black and white photo of a propeller plane
216,a black and white photo of a city street
217,a boat that is sitting in the water
218,a wooden chair sitting next to a wooden chair
219,a blue and white train traveling down train tracks
220,a blue car parked in front of a house
221,a group of buses parked in a parking lot
222,a living room with a tv and a couch
223,a woman standing in a room holding a wii remote
224,a flat screen tv sitting on top of a shelf
225,four bowls of different kinds of food
226,a couple of men standing next to each other
227,a small airplane flying in the sky
228,a close up of a couch with a wooden headboard
229,a couple of beds sitting in a room
230,two cats sitting on a couch next to each other
231,a small bird sitting on a wooden bench
232,a motorcycle parked on the side of the road
233,a black and white photo of a tree
234,a woman is sitting on a yellow motorcycle
235,a group of three red vases sitting on top of each other
236,a black cat is playing with a toy
237,a bottle of wine sitting next to a bottle of wine
238,a living room filled with furniture and a fire place
239,a laptop computer sitting on top of a desk
240,a bus is parked on the side of the street
241,a broken broken toilet sitting on the ground
242,a bottle of wine sitting on top of a table
243,a living room with a tv and a couch
244,a brown horse running on a dirt field
245,two green birds are sitting on a shelf
246,a cat that is sitting on a counter
247,a blue and white curtain and a window
248,a car parked in a parking lot next to a green car
249,a black and white dog with a black collar
250,a woman standing in the sand holding a cell phone
251,a white dog is sleeping on the floor
252,a person riding a motorcycle on a road
253,a group of people sitting in a living room
254,a man in a helmet is riding a motorcycle
255,a man standing next to a bike in a store
256,a horse with a saddle on its back
257,a large air plane on a run way
258,a person riding a horse jumping over a fence
259,a red car parked in a parking lot
260,a train on a train track with trees in the background
261,a black and red train is on the tracks
262,a woman riding a bike down a road
263,a black and white cow standing on top of a grass covered field
264,a man standing on a tiled floor next to a window
265,a black and white dog laying on a bed
266,a view of a mountain range with trees in the background
267,a bike parked next to a flower pot
268,a double decker bus driving down a street
269,a kitchen with a table chairs and a refrigerator
270,a woman holding a bottle of wine in a kitchen
271,a couple of women sitting next to each other
272,a white swan swimming in the water
273,a close up of a metal bike tire
274,a motorcycle parked on the side of the road
275,a yellow and green train traveling down train tracks
276,a bottle of wine and a wine glass
277,a double decker bus is parked on the street
278,a subway train with its doors open on the tracks
279,a couple of cows standing next to a river
280,a large air plane on a run way
281,a motorcycle parked on the side of a street
282,a couple of motorcycles parked next to each other
283,a picture of a cat on a wall
284,a person on a surfboard in the water
285,a pair of scissors sitting on top of a table
286,a cat sitting on top of a book shelf
287,a train traveling down train tracks near a train station
288,a cat laying on a couch next to a cat
289,a large ship in the water with a large ship in the background
290,a close up of a bird on a beach
291,a green double decker bus parked on the side of a building
292,a brown and white cow grazing in a field
293,a train traveling down train tracks next to a forest
294,a television is sitting on top of a box
295,a bottle of alcohol sitting next to a bottle
296,a group of people riding bikes down a dirt road
297,a group of sheep grazing on a lush green field
298,a man standing on top of a yellow and black plane
299,a brown horse grazing on grass in a field
