0,1
0,a cat lying on a carpet
1,a bird sitting on the ground
2,a bottle and a glass of liquid
3,a car on a road by the water
4,a bird standing in the grass
5,a bird on a plant
6,a white bird flying in the air
7,a sheep in a fenced pasture
8,a person with long hair
9,a table with plates and glasses on it
10,a couple of birds on a tree branch
11,a large stone building with a clock on it
12,horses in a barn
13,a sheep grazing in a field
14,a group of people in the ocean
15,a couch with a lamp on top
16,a cow standing on a hill
17,a group of chairs
18,a person in a wheelchair pulled by a couple of horses
19,a living room with a black couch
20,a cat looking at the camera
21,a train with its doors open
22,a chair in a room
23,a person's legs and a couch in a room
24,a boat in the water
25,a dog lying in the sand
26,a cow grazing in a field
27,a cat with glowing eyes
28,a room with couches and a table
29,a train on the railway tracks
30,a cow looking at the camera
31,a living room with a fireplace
32,a motorcycle parked on a road
33,a man wearing a hat and glasses looking at a train
34,a dog standing in a grassy area
35,a bus on the street
36,a dog lying under a table
37,a horse with a halter
38,a cat lying on a blanket
39,a large white truck drives down the road
40,a bird with a red and black beak
41,a cat lying on a rug
42,a bicycle parked on a street
43,a sheep grazing in a fenced in pasture
44,a cat on a chair
45,a bird standing in a field
46,a dog lying on a couch
47,a plane taking off from a runway
48,a passenger airplane on the runway
49,a man and a woman standing in front of a house with flags
50,a laptop with a fork and knife
51,a red race car
52,a man and woman petting a horse
53,a motorcycle parked on a road
54,a military plane in a hangar
55,several boats in a large building
56,a rabbit sitting on a couch
57,a dog lying on a rug
58,a dog standing on leaves
59,a motorcycle parked on the pavement
60,a rocket ship on a pole
61,a bird standing on a flower
62,a table with food and drinks
63,a blue truck with gold writing
64,a group of red buses parked on the side of a street
65,a passenger airplane taking off
66,a living room with a couch
67,a couple of bulls eating grass
68,a bicycle in the snow
69,a horse eating grass
70,a cat sitting in front of a window
71,an airplane is being prepared for a flight
72,a person holding a bottle of beer
73,a computer monitor on a desk
74,a cat lying down
75,a moose standing in front of a building
76,a yellow school bus parked on the side of a road
77,a person standing next to a train
78,a man sitting on a chair next to a man sitting in a chair
79,a person standing on a sidewalk
80,a man looking at a paper
81,a train travels down the tracks
82,a seagull flying over the ocean
83,a cat looking out a window
84,a person riding a horse
85,a man and a woman smiling
86,a person riding a horse
87,a table and chairs outside
88,a bicycle with a basket and a basket
89,a horse and a foal
90,a group of people sitting around a table with a baby
91,a group of dogs sitting on a bed
92,a red and yellow bicycle
93,a white dog lying on a red and white striped surface
94,a person riding a bicycle
95,a bicycle parked on the pavement
96,a man riding a motorcycle
97,a sheep with a black hat on its head
98,a bird perched on a tree branch
99,a black ladder leaning against a red wall
100,a person standing next to a double decker bus
101,a car parked on a brick surface
102,a person on a motorcycle
103,a dog sitting in the driver's seat of a car
104,a train on the railway tracks
105,a person riding a horse
106,a boat on a boat
107,a baby in a car seat
108,a green double decker bus
109,a group of potted plants on a table
110,a couple of people kayaking in a river
111,two men standing on a road
112,a double decker bus on the street
113,a table and chairs in a room
114,a sailboat on the water in front of a city
115,a cat with a cigarette in its mouth
116,a red couch in a room
117,a person on a bicycle
118,a train on the railway tracks
119,a wall with a light switch
120,a dog lying down
121,a red car with a black door
122,the back of a car
123,a baby owl in the grass
124,a horse in a field
125,a computer on a table
126,a double decker bus on the street
127,a white cell phone
128,a black and white cow in a pen
129,a couple of birds flying in the sky
130,a small airplane flying in the sky
131,a woman leaning against a fence
132,a bottle of wine next to a glass of wine
133,people waiting in a subway
134,a plant in a pot
135,a red motorcycle parked
136,a row of motorcycles parked on the side of a street
137,a horse standing behind a fence
138,a group of people in a living room
139,a close up of a cat
140,a man riding a skateboard
141,a red scooter parked on the side of a road
142,a row of fishing poles on a boat in the water
143,a bus parked on the side of the road
144,a cat lying on a chair
145,a man in a uniform holding a rifle
146,a group of people in a blue van
147,a plane flying in the sky
148,a shelf with many bottles of wine
149,a bicycle with a helmet on it
150,a train on the railway tracks
151,a bus on the street
152,a group of potted plants
153,a room with a table and chairs
154,a boat in the water
155,a boat sailing on the water
156,a yellow double decker bus
157,a group of people sitting at a table with drinks
158,a group of cactus in pots
159,a person sitting in a chair
160,a person standing on a motorcycle
161,a bicycle parked under a tree
162,a dog standing on a dirt road
163,a person sitting on a bench
164,a couple of men stand near each other
165,a person standing on a dirt path
166,a sign on a tree
167,a person lying on a couch with a cat on the lap
168,a large airplane flying in the sky
169,a couple of cows walking down a street
170,a dog lying on a bed
171,a bird standing in the snow
172,a yellow car on the road
173,a train on the railway tracks
174,a red car parked on the side of the road
175,a man holding a bottle
176,a table and chairs in a room
177,a cat lying on a chair
178,a boat on the water
179,a group of buses parked
180,a living room with a blue chair and a book shelf
181,a cow lying on the grass
182,a shelf with books and knick knacks
183,a bird perched on a branch
184,a large silver airplane in a hangar
185,a group of cats playing in the grass
186,a cat standing on the ground
187,a dog lying on the grass
188,a group of sheep in a field
189,a horse with a saddle on
190,a bus travels down the street
191,a person standing next to a horse
192,a person riding a motorcycle
193,a white goat on a rocky hill
194,a sheep grazing on a hill by a lake
195,a large stone arch with a red bus and cars on it with Arc de Triomphe in the background
196,a yellow and black race car
197,a few school buses parked
198,a man standing on a boat in the water
199,a large airplane flying in the sky
200,a person standing in a train
201,a cat lying on a man's chest
202,a boy standing in a dark room
203,a cat lying on a blanket
204,a group of birds flying in the sky
205,a person petting a dog
206,a train on the railway tracks
207,a fish caught in a net
208,two dogs playing in the snow
209,a baby sheep and its mother
210,a dog walking on a sidewalk
211,a plane flying in the sky
212,a horse eating some grass
213,a bicycle parked on a sidewalk
214,a brown and white animal
215,a large airplane in the air
216,a boat in the water
217,a boat in the water
218,a wooden chair with a cushion
219,a train on the railway tracks
220,a blue van parked on grass
221,buses parked in a parking lot
222,a tv on a stand
223,a person standing on a stool
224,a tv on a shelf
225,a group of plants in pots
226,a man holding a bottle of water and a man on a bicycle
227,a plane flying in the sky
228,a man sitting on a bench
229,a couch with a cushion
230,two cats lying on a couch
231,a bird with a long beak
232,a motorcycle parked on the side of the road
233,a group of sheep in a foggy field
234,a person on a motorcycle
235,a group of glasses with liquid in them
236,a black and white cat
237,a man and woman laughing
238,a living room with a fireplace
239,a computer monitor on a desk
240,a blue and white bus on the street
241,a broken down garbage can
242,a bottle of champagne
243,a living room with a tv and furniture
244,a man riding a horse
245,a group of birds on a perch
246,a cat with a blue collar
247,a couch in front of a building
248,a white car with a blue and yellow stripe on the side
249,a dog looking at the camera
250,a girl holding a bottle of beer
251,a dog lying on a person's lap
252,a man riding a motorcycle
253,a group of women sitting on a couch
254,a man doing a stunt on a dirt bike
255,a man standing next to a bicycle
256,a horse with a saddle
257,a large airplane is parked at an airport
258,a person riding a horse
259,a red car with a black background
260,a train on the tracks
261,a train on the railway tracks
262,a person riding a bike on a road
263,a cow lying down in a pen
264,a person standing in a room
265,a dog lying on a bed
266,a sheep in a field
267,a group of bicycles parked next to a wall
268,a double decker bus on the street
269,a room with a chair and a desk
270,a person holding a bottle of alcohol
271,a person laughing with a baby
272,a swan swimming in water
273,a close-up of a machine
274,a blue motorcycle parked on pavement
275,a train on the tracks
276,a bottle of beer
277,a red and yellow train
278,a train with doors
279,cows drinking water from a stream
280,a large airplane on the runway
281,a motorcycle parked on a sidewalk
282,a group of motorcycles parked next to a brick wall
283,two cats on a couch
284,a rocky beach with a body of water
285,a dog next to a potted plant
286,a cat on a shelf
287,a couple of trains in a station
288,a cat and a dog lying together
289,a large cruise ship in the water
290,a bird standing on a wood surface
291,a bus with a sign on the side
292,a brown cow standing on grass
293,a train on the railway tracks
294,a television with a box and a box on it
295,a soda bottle with a red label
296,a group of people riding bikes
297,sheep grazing in a field
298,a fighter jet flying through the air
299,a brown horse in a fenced in pasture
