0,1,2
0,a man riding a motorcycle on a dirt road.,0.9916037917137146
1,a woman sitting at a table with a bowl of food.,0.9795083999633789
10,a bathroom with a toilet and a sink and a window.,0.9882504343986511
100,a young girl eating a slice of pizza.,0.9504106044769287
101,a woman holding a tennis racket in a room.,0.9919255971908569
102,a slice of pizza on a wooden cutting board.,0.98625248670578
103,a couch with pillows and a table in a room.,0.8821226358413696
104,a close up of a man with a bald head.,0.9581538438796997
105,a living room with a table and chairs and a couch.,0.970491886138916
106,a man sitting at a desk using a computer.,0.9968973994255066
107,a man walking on the beach holding a kite.,0.9182321429252625
108,a man is flying a blue kite in a field.,0.9422605633735657
109,a man holding a little girl on a swing.,0.996173083782196
11,a man wearing glasses and a black shirt and a tie.,0.9777427911758423
110,a group of kites flying in the blue sky.,0.9752765893936157
111,a clock on a pole on the side of a street.,0.8903040289878845
112,a baseball player swinging a bat on a field.,0.9917800426483154
113,a baseball player holding a bat on a field.,0.999972939491272
114,a young boy holding a baseball bat on a field.,0.9414858818054199
115,a young boy in a baseball uniform holding a bat.,0.9776583909988403
116,a baseball player holding a bat on a field.,0.9907079935073853
117,a man is holding a stick in a space with a light.,0.8773556351661682
118,a person is holding a pizza in an oven.,0.9677312970161438
119,a group of people standing on a tennis court.,0.9999271631240845
12,a black and white photo of a man on a motorcycle.,0.9316808581352234
120,a young man swinging a tennis racket at a tennis ball.,0.9820048809051514
121,a group of people standing outside of a building with a clock.,0.9401071071624756
122,a couple of cups sitting on top of a table.,0.9023745059967041
123,a man in a brown shirt talking on a cell phone.,0.9236270189285278
124,a building with a clock tower on top of it.,0.9967116713523865
125,a woman brushing a cat's hair with a brush.,0.9428192973136902
126,a large building with a clock tower on top of it.,0.9929094314575195
127,a group of stuffed teddy bears sitting on a bed.,0.9607311487197876
128,a building with a clock tower on the top of it.,0.9273092150688171
129,a vase filled with white flowers on a table.,0.9675850868225098
13,a row of motorcycles parked on the side of a street.,0.9946883916854858
130,a bunch of purple flowers in a vase.,0.9861065149307251
131,a man holding a large pair of scissors.,0.996539294719696
132,a pair of scissors and other tools on a table.,0.8858951330184937
133,a group of people sitting at a table.,0.986280083656311
134,a woman standing next to a group of people.,0.9966544508934021
135,a group of people sitting around a table with wine bottles.,0.9884536266326904
136,a man standing in a room with a wine glass.,0.9579983353614807
137,a group of people walking down a street with luggage.,0.9857038855552673
138,a bunch of food on a counter top.,0.8794072866439819
139,a woman standing in a kitchen with a dog.,0.9970806241035461
14,a living room with a chair and a television.,0.9698806405067444
140,a woman standing next to an old fashioned stove.,0.9222344160079956
141,a man sitting on a stool at a kitchen counter.,0.9507891535758972
142,a man standing in a kitchen with a dog.,0.9069023728370667
143,a wooden table with a bunch of pots and pans on it.,0.9312446713447571
144,a group of young people standing on a city street.,0.9782572388648987
145,a black and white photo of a man standing next to a bicycle.,0.9360821843147278
146,a bathroom with a toilet and a shelf with toothbrushes.,0.9766684174537659
147,a bathroom with a sink and a mirror.,0.998866081237793
148,a bathroom with a toilet and a shower.,0.9585263133049011
149,a couple of people riding a motorcycle on a bridge.,0.9852941632270813
15,a painting of a vase and fruit on a table.,0.9568497538566589
150,a white toilet sitting in a room with a brush.,0.9503602385520935
151,a large clock on the side of a building.,0.9993798732757568
152,a couple of people sitting on motorcycles in the rain.,0.9266020059585571
153,a group of people walking in front of two planes.,0.8924888968467712
154,a red plane flying through a blue sky with smoke.,0.9266462922096252
155,a large airplane is flying in the sky.,0.8788358569145203
156,a red and white plane flying in the sky.,0.9197294116020203
157,a red airplane flying through a blue sky.,0.9545137286186218
158,a group of sheep grazing on a beach near the ocean.,0.8996429443359375
159,a tall giraffe standing in a dry grass field.,0.8961843252182007
16,a bunch of bananas sitting on top of each other.,0.962456226348877
160,a close up of a giraffe with trees in the background.,0.9268083572387695
161,a traffic light in front of a city street at sunset.,0.967678964138031
162,a street at night with a traffic light and a fountain.,0.9468522071838379
163,two giraffes standing next to a fence.,0.9517386555671692
164,a giraffe eating hay from a feeder in a forest.,0.9750295281410217
165,a couple of giraffes eating hay from a feeder.,0.9657942652702332
166,a yellow fire hydrant sitting next to a pole.,0.9602614641189575
167,a group of sheep standing in a field.,0.9922166466712952
168,a man sitting on a bench by the water.,0.9796768426895142
169,a giraffe standing in front of a building.,0.9522778391838074
17,a motorcycle is parked in front of a bunch of wine bottles.,0.8889621496200562
170,a couple of ducks swimming in a body of water.,0.977005660533905
171,a group of giraffes standing next to a wooden fence.,0.9990343451499939
172,a giraffe and a zebra in a zoo.,0.9320939779281616
173,a street sign on a pole next to a traffic light.,0.9809519648551941
174,a giraffe is eating grass in a field.,0.9195103645324707
175,a couple of giraffes eating from a feeder.,0.9344528913497925
176,a large herd of animals in a field.,0.8879022002220154
177,a herd of sheep grazing in a field.,0.9865750074386597
178,a group of trees in the background of a fog.,0.9173035621643066
179,a open drawer of a truck filled with hay.,0.7599620819091797
18,a man is getting off of an airplane at an airport.,0.8893492221832275
180,a train on a bridge over a busy city street.,0.8923850655555725
181,a red and yellow train is on the tracks.,0.9085105061531067
182,a stop sign is covered in a pile of snow.,0.9432184100151062
183,a red and yellow train at a train station.,0.9899600148200989
184,a red stop sign sitting on the side of a road.,0.9766791462898254
185,a cat sitting on top of a red suitcase.,0.9246717095375061
186,a cat sitting on a porch looking out of a window.,0.892505407333374
187,a red fire truck with people standing around it.,0.8546523451805115
188,a group of people standing next to each other.,0.9699646234512329
189,a brown and white dog wearing a tie.,0.9680994749069214
19,a view of an airport with planes parked at the runway.,0.9382321834564209
190,a close up of a boat on the water.,0.9384337663650513
191,a group of boats are lined up on the water.,0.8249880075454712
192,a picture of a man and a woman.,0.9627923369407654
193,a group of people walking in the rain with umbrellas.,0.9457939267158508
194,a cat laying in a bathroom sink.,0.9998353719711304
195,a couple of cats sleeping on a pile of towels.,0.9908650517463684
196,a man sitting on a couch with a cat and a laptop.,0.9984215497970581
197,a man standing next to an elephant.,0.982376754283905
198,a dog jumping in the air to catch a frisbee.,0.9963346719741821
199,a couple of dogs playing with a frisbee in the snow.,0.9741851687431335
2,a man riding a bike in front of a train.,0.9533701539039612
20,a small blue and white plane is sitting on the grass.,0.9046135544776917
200,two black cell phones sitting next to each other.,0.872783899307251
201,a man standing in front of a luggage carousel at an airport.,0.9169813990592957
202,a brown dog holding a purple frisbee in its mouth.,0.9551024436950684
203,a group of zebras standing in a field with birds.,0.9225482940673828
204,a young girl holding a red frisbee in a yard.,0.9792414903640747
205,a group of zebras and other animals in a field.,0.9870833158493042
206,a herd of zebras standing in a field.,0.9554307460784912
207,a zebra walking down a dirt road.,0.9360796809196472
208,a brown horse walking through a forest with trees.,0.9563212394714355
209,a man standing in front of a statue of a horse.,0.9533776640892029
21,a red and yellow motorcycle parked in a field with sheep.,0.9968408346176147
210,a bunch of bananas in a bag.,0.9873763918876648
211,a person is riding a board in the water.,0.9459739327430725
212,a couple of people cross country skiing in the snow.,0.9292258620262146
213,a pile of oranges sitting on top of each other.,0.9970188140869141
214,a bunch of oranges sitting on top of a pile.,0.9538358449935913
215,a woman is skiing down a snow covered slope.,0.9628582000732422
216,a couple of baseball players standing on a field.,0.996547520160675
217,a couple of men riding skis in front of a crowd.,0.8592925071716309
218,a couple of young men riding skateboards down a sidewalk.,0.9623615741729736
219,a woman cross country skiing in the snow.,0.9637361764907837
22,a man sitting on a bench with a white dog.,0.9938511252403259
220,a woman is skiing down a snow covered slope.,0.9918867349624634
221,a group of young boys wearing helmets and riding their bikes at a skate park.,0.9342968463897705
222,a green tray filled with fruits and vegetables on a table.,0.875673770904541
223,a table topped with bowls of food and plates of food.,0.9667978286743164
224,a group of people on skis in the snow.,0.9983336329460144
225,a man eating an apple while standing on a sidewalk.,0.8965522646903992
226,a man doing a trick on a skateboard on a ramp.,0.9997746348381042
227,a chocolate donut sitting on a basket next to a cup of coffee.,0.9554035067558289
228,a piece of food sitting next to a bowl of soup.,0.8452926278114319
229,a bowl of ice cream and a spoon on a table.,0.9507706761360168
23,a traffic light on a pole with a blue sky.,0.9670165777206421
230,a piece of chocolate cake on a white plate.,0.9553126692771912
231,a man sleeping in bed with two cats.,0.9179200530052185
232,a bedroom with a bed and posters on the wall.,0.9836533069610596
233,a person is cutting a birthday cake on a table.,0.9091111421585083
234,a woman standing in front of a cake.,0.9420427680015564
235,a couple of women holding up a cake.,0.9494422078132629
236,two women standing next to each other holding a picture.,0.9151315689086914
237,a man is standing on a paddle board in the water.,0.900141716003418
238,a group of people standing on the beach with surfboards.,0.9639759063720703
239,a pizza sitting on top of a metal pan.,0.9107228517532349
24,a dining room table with yellow flowers in a vase.,0.9075035452842712
240,a man standing on a tennis court holding a racket.,0.9454056024551392
241,a pizza on a plate on a table.,0.972777783870697
242,a person holding a slice of pizza on a plate.,0.9391496777534485
243,a group of people sitting at a table with pizzas.,0.9541499018669128
244,a man holding a tennis racket on a tennis court.,0.9885671734809875
245,a living room with a couch and a table.,0.9834116697311401
246,two young men playing a video game in a living room.,0.9622414112091064
247,a little girl holding a video game controller in her hand.,0.9455584287643433
248,a desk with two laptops and two computer monitors.,0.9615227580070496
249,a living room and dining room with a table and chairs.,0.9985140562057495
25,a group of people standing on a sidewalk with metal gates.,0.7704464197158813
250,a small animal running in a field with a person.,0.9179115295410156
251,a pitcher throwing a ball to a batter at a baseball game.,0.9366861581802368
252,a baseball player swinging a bat at a ball.,0.9999538660049438
253,a large clock on the side of a building.,0.9308511018753052
254,a close up of a person sitting in a car with a laptop.,0.9352539777755737
255,a laptop computer sitting on a table next to a glass of beer.,0.9763442277908325
256,a person holding a cell phone in their hand.,0.9989721775054932
257,a woman holding two cell phones in her hands.,0.9917777180671692
258,a woman taking a dish of food out of an oven.,0.9030184149742126
259,a little girl is holding a hair dryer.,0.9326367378234863
26,a snow covered house behind trees and a fence.,0.8085881471633911
260,a plate of food with meat and vegetables next to bottles of wine.,0.8988394141197205
261,two young boys sitting next to each other holding a teddy bear.,0.9562004208564758
262,a woman sitting at a table in a restaurant.,0.9869457483291626
263,a kitchen counter with a cake on top of it.,0.9966813325881958
264,a laptop computer sitting on top of a wooden table.,0.999809980392456
265,a kitchen with a white refrigerator and a stove.,0.9091084599494934
266,a bathroom with a pipe and a wall.,0.8457567095756531
267,a bathroom with a toilet and a window.,0.9546207189559937
268,a bathroom with a toilet and a sink and a bath tub.,0.9949778318405151
269,a yellow and blue bathroom with a washing machine in it.,0.9135664701461792
27,a group of birds flying in the sky.,0.9777565598487854
270,a small bathroom with a sink and a window.,0.9710831046104431
271,a black cat with green eyes sitting in front of a sink.,0.8770292401313782
272,a dog sitting in the passenger seat of a car.,0.9920798540115356
273,a view of a busy city street with cars and buses.,0.9062922596931458
274,a white toilet with a shower head in a bathroom.,0.9365529417991638
275,a white bathroom with a sink and a toilet.,0.9850226044654846
276,a cat is standing on top of a toilet bowl.,0.9459537267684937
277,a black and white cat sitting on a green blanket.,0.9763976335525513
278,a bunch of oranges in a white bowl.,0.9610646367073059
279,a blue and yellow plane flying in the sky.,0.951797604560852
28,a boat with a swan in the water.,0.9622616767883301
280,a couple of planes flying in the sky over trees.,0.8945798873901367
281,a large airplane flying in the sky over trees.,0.947065532207489
282,a bird sitting on the neck of a giraffe.,0.9314378499984741
283,a plane flying in the sky over tall buildings.,0.8802712559700012
284,a large airplane flying in the sky between two tall buildings.,0.924899697303772
285,a giraffe standing in a field of grass.,0.9544427394866943
286,a city street with green traffic lights at an intersection.,0.9490306377410889
287,a book sitting on top of a wooden bench.,0.9663098454475403
288,a traffic light with a green light on a street.,0.9977187514305115
289,a large herd of sheep grazing on the side of a road.,0.9284185767173767
29,a couple of giraffes and other animals in a field.,0.9953687191009521
290,a woman petting a sheep in a field.,0.9778567552566528
291,a large bird flying over a field of grass.,0.9866688251495361
292,a man standing in a boat on the water.,0.9578815698623657
293,a man riding an elephant down a street with a sign.,0.9223572015762329
294,a man sitting on a bed in a hospital room.,0.9798591732978821
295,a blue and white train sitting on the tracks.,0.9369462132453918
296,a bird perched on top of a telephone pole.,0.9358912706375122
297,a couple of birds standing in a cage.,0.9648193120956421
298,a close up of a person wearing a blue and white surfboard.,0.9192620515823364
299,a woman standing in front of a cake.,0.9820610284805298
3,a kitchen sink and a window in a room.,0.8962792754173279
30,a yellow fire hydrant in front of a building at night.,0.9980688095092773
31,a black bird is standing in a flower pot with an apple.,0.9041538238525391
32,a black and white photo of a building with a clock tower.,0.9966704845428467
33,a couple of geese swimming in the water.,0.9633809924125671
34,a couple of street signs on a wooden pole.,0.961479127407074
35,a sheep standing in a field next to a road.,0.9989688396453857
36,a couple of men standing next to each other holding a snowboard.,0.9055955410003662
37,a group of signs on a pole in front of a red brick building.,0.9429727792739868
38,a cow standing in front of a building.,0.888578474521637
39,a cow standing next to a blue barrel in a market.,0.9465983510017395
4,a group of wooden spoons sitting on top of a table.,0.8842511177062988
40,a cat eating a banana from a person holding a banana.,0.9338604211807251
41,a cat sitting on a chair next to a table.,0.9996675848960876
42,a white cow standing in a field with other cows.,0.924038827419281
43,a black and white cow standing in a field of grass.,0.9973299503326416
44,a close up of a doll with a tie.,0.8912892937660217
45,a group of elephants standing in an enclosure.,0.9239025712013245
46,an elephant standing next to a tree in a forest.,0.9515752792358398
47,two yellow kayaks sitting on the shore of the ocean.,0.9160149097442627
48,a group of boats are docked in the water.,0.9842153191566467
49,an elephant and a rhino walking in a field.,0.9105369448661804
5,a wooden table with a bunch of wooden spoons on it.,0.9560506343841553
50,a woman holding a child on her lap.,0.9028457999229431
51,a woman in a dress sitting on top of a suitcase.,0.9968491196632385
52,a woman sitting on a suitcase in the woods.,0.968049168586731
53,a young child sitting in a chair in a bathroom.,0.9321931600570679
54,a brown dog laying next to a swimming pool.,0.9676347374916077
55,a couple of girls walking with umbrellas in the rain.,0.9554234743118286
56,a black dog sitting on the floor next to a toy.,0.969507098197937
57,a man walking on a beach in the sand.,0.932112991809845
58,a person walking two dogs on a dirt road.,0.9607279896736145
59,a close up of a zebra grazing in the grass.,0.9305712580680847
6,a small bathroom with a toilet and a shower.,0.977402925491333
60,a zebra standing in the snow in a field.,0.9547210335731506
61,a couple of zebra and two other animals grazing in a field.,0.9550190567970276
62,a couple of zebras playing in a field of grass.,0.8975674510002136
63,a group of toy horses standing next to each other.,0.9486173987388611
64,a woman is standing next to a horse and a car.,0.8978177905082703
65,a person riding a horse in front of a church.,0.930252194404602
66,a painting of a man and a horse in the snow.,0.9814498424530029
67,a banana and three oranges on a counter.,0.9974148273468018
68,a group of children standing in a field playing baseball.,0.9920469522476196
69,a person wearing a bunch of bananas on his head.,0.9796960949897766
7,a bathroom with a toilet and a shower and a sink.,0.9862578511238098
70,a man wearing a bunch of bananas on his head.,0.9796990752220154
71,a baseball player throwing a ball on a field.,0.9817328453063965
72,a white plate of food with sandwiches and a salad.,0.9491726160049438
73,a man and a little girl standing in the snow.,0.990017294883728
74,a young boy holding a bowl of candy.,0.9013199806213379
75,a woman standing in front of a store.,0.9845288395881653
76,a man doing a trick on a skateboard in the air.,0.9930686354637146
77,a couple of young boys riding skateboards on a sidewalk.,0.937968373298645
78,a couple of men riding snowboards down a snow covered slope.,0.9734854102134705
79,a woman sitting at a table eating a hot dog.,0.9998655915260315
8,a group of people riding bikes down a city street.,0.9890564680099487
80,a man standing in a room holding a snowboard.,0.9549989104270935
81,a display case in a bakery filled with lots of donuts and sandwiches.,0.9394756555557251
82,a young boy eating a piece of food.,0.9511149525642395
83,a display case filled with lots of different types of donuts.,0.9546854496002197
84,a white plate of food with a sandwich and a pickle.,0.9745446443557739
85,a sandwich and two drinks on a table.,0.9092750549316406
86,a display case filled with lots of different types of donuts.,0.9742247462272644
87,a young man holding a basketball in a gym.,0.9198663234710693
88,a woman in a wet suit holding a white surfboard.,0.9271711707115173
89,a man holding a soccer ball on a field.,0.9996008276939392
9,a bathroom with a sink and a toilet and a mirror.,0.9955151677131653
90,a man riding a wave on a surfboard in the ocean.,0.9955777525901794
91,a group of young men standing on a soccer field.,0.9116352796554565
92,a woman standing in front of a cake.,0.9758114814758301
93,a young boy eating a piece of cake.,0.8897088766098022
94,a group of young children holding soccer balls in a field.,0.9230175614356995
95,a man sitting at a table with a pizza.,0.9995536208152771
96,a young child laying on a bed.,0.9820482134819031
97,a man and a woman laying in a bed in a room.,0.9443914890289307
98,a close up of a pizza with tomatoes and cheese.,0.9658271670341492
99,a couple of tennis rackets sitting on a table.,0.8815508484840393
