0,1
0,a man standing on a dirt road holding a skateboard
1,a woman is blowing out candles on a cake
2,a man riding a bike next to a train
3,a kitchen with a sink and a window
4,a pile of different kinds of scissors
5,a wooden table with a bunch of wooden benches
6,a bathroom with a toilet sink and shower
7,a bathroom with a shower and a sink
8,a person riding a bike on a city street
9,a bathroom with a sink and a toilet
10,a bathroom with a toilet and a sink
11,a man wearing glasses and a tie
12,a man riding on the back of a motorcycle
13,a row of motorcycles parked next to a building
14,a bed sitting in a room next to a book shelf
15,a picture of a vase with a clock on it
16,a bunch of different types of vegetables on display
17,a motorcycle parked next to a wooden fence
18,a large jetliner sitting on top of an airport tarmac
19,a view of an airport with a plane in the background
20,a small airplane is sitting on the grass
21,a red and black motorcycle parked in a sandy area
22,a couple of people riding on the back of a white horse
23,a traffic light with a green light
24,a table with a vase of flowers on it
25,a group of people standing around a tennis court
26,a herd of sheep standing next to a wooden fence
27,a flock of birds flying over a body of water
28,a boat that is floating in the water
29,a couple of giraffe standing next to each other
30,a yellow fire hydrant in a dark room
31,a black bird is eating a piece of cake
32,a black and white photo of a street sign
33,a couple of ducks swimming in a lake
34,a close up of a street sign with a sky background
35,a sheep standing on a lush green field
36,a man in a santa hat sitting on a bench
37,a stop sign on the corner of a street
38,a cow is standing in front of a store
39,a cow standing on a dirt ground near a building
40,a small kitten is eating a banana on the floor
41,a cat sitting in a chair next to a book
42,a couple of cows are standing in a field
43,a black and white cow standing in a field
44,a woman with a beard and a tie
45,a group of elephants standing in a dirt field
46,a couple of elephants standing next to a tree
47,a couple of surfboards sitting on top of a beach
48,a group of boats parked in a harbor
49,a couple of elephants standing in a field
50,a couple of people that are sitting down
51,a person holding a piece of luggage in a room
52,a woman sitting on the ground talking on a cell phone
53,a baby is sitting on the floor in a bathroom
54,a dog is sleeping on the side of the road
55,a couple of people walking down a street
56,a black dog standing next to a plate of food
57,a person walking on a beach with a surfboard
58,a person riding a motorcycle on a dirt road
59,a couple of zebra standing next to each other
60,a zebra standing in the snow near a building
61,a group of zebras grazing in a field
62,a couple of zebras are standing in a field
63,a group of horses standing next to each other
64,a woman is petting a horse in a field
65,a man is sitting on a bench in front of a building
66,a woman standing next to a white horse
67,a banana sitting on top of a white plate
68,a group of young children playing a game of softball
69,a woman with a bunch of bananas on her head
70,a young girl holding a banana in her hand
71,a baseball player pitching a ball on a field
72,a white plate topped with sandwiches and fries
73,a couple of people riding skis down a snow covered slope
74,a young boy holding a plate of food
75,a woman walking down the street with a skateboard
76,a man riding a skateboard up the side of a ramp
77,a couple of people that are standing in the street
78,a couple of men standing on top of a snow covered slope
79,a woman eating a sandwich at a restaurant
80,a man in a blue sweater and a tie
81,a display case filled with lots of donuts
82,a young boy holding a sandwich in his hand
83,a display case in a bakery filled with donuts
84,a white plate topped with a sandwich and salad
85,a bottle of milk next to a bottle of milk
86,a close up of a donut with sprinkles
87,a man standing in a room with a microphone
88,a man standing on a beach holding a surfboard
89,a man standing on a field holding a baseball bat
90,a man riding a wave on top of a surfboard
91,a group of young men playing a game of soccer
92,a woman is holding a plate of food
93,a baby is eating a piece of cake
94,a group of people standing in a field
95,a man sitting at a table with a pizza
96,a bed with a pink and white comforter
97,a man and woman pose for a picture
98,a close up of a pizza on a plate
99,a tennis racket with a pink ball on it
100,a young boy eating a piece of pizza
101,a woman holding a tennis racquet on a tennis court
102,a wooden cutting board topped with a pizza
103,a bed with a blanket and pillows on it
104,a close up of a person holding a pair of scissors
105,a living room filled with furniture and a dog
106,a group of people playing a video game
107,a person on a beach with a kite
108,a person in a field with a kite
109,a woman holding a kite in her hand
110,a kite is flying high in the sky
111,a clock on a pole on a city street
112,a group of people on a field playing baseball
113,a baseball player holding a bat on a field
114,a baseball player holding a bat on a field
115,a young boy in a baseball uniform holding a bat
116,a baseball player holding a bat on a field
117,a man in a yellow shirt holding a tennis racquet
118,a close up of a person holding a pizza
119,a woman holding a tennis racquet on a tennis court
120,a man is swinging a tennis racket at a ball
121,a group of people standing on a street
122,a cup of coffee and a white vase
123,a group of people standing next to each other
124,a crowd of people standing in front of a large building
125,a man sitting on a couch with a dog
126,a large building with a clock on it
127,a group of stuffed animals sitting next to each other
128,a large building with a clock on it
129,a vase filled with white and green flowers
130,a white vase filled with purple and purple flowers
131,a man holding a pair of scissors in his hands
132,a close up of a pair of scissors and a carrot
133,a group of people sitting at a table with a cake
134,a group of people sitting in a field
135,a group of people sitting at a table
136,a man holding a wine glass in a kitchen
137,a group of people standing next to each other
138,a bunch of items that are on a table
139,a woman standing in a kitchen next to a window
140,a woman standing in a kitchen preparing food
141,a man standing in a kitchen next to a refrigerator
142,a woman standing in a kitchen next to a dog
143,a kitchen with a bunch of pots and pans
144,a man is holding a skateboard on a sidewalk
145,a man riding a bike down a street
146,a bathroom with a toilet sink and mirror
147,a bathroom with a sink and a mirror
148,a bathroom with a toilet and a sink
149,a view of a wooden structure with a clock on it
150,a white toilet sitting inside of a bathroom
151,a large building with a large clock on it
152,a man riding on the back of a motorcycle
153,a man standing next to a plane on a runway
154,a small plane flying through a blue sky
155,a white and blue airplane flying in the sky
156,a man standing in front of a yellow plane
157,a red and white plane flying in the sky
158,a herd of cattle grazing on a beach
159,a giraffe standing in a dry grass field
160,a close up of a giraffe with a sky background
161,a traffic light sitting in front of a tall building
162,a city street with traffic lights and street lights
163,a giraffe standing on top of a dirt field
164,a tall giraffe standing next to a tree
165,a couple of giraffe standing on top of a dirt field
166,a fire hydrant sitting in the middle of a sidewalk
167,a herd of sheep standing on top of a lush green field
168,a man sitting on a bench near the ocean
169,a giraffe is standing in a zoo enclosure
170,a couple of birds that are in the water
171,a couple of giraffe standing next to each other
172,a giraffe standing next to a pile of rocks
173,a street sign that is on a pole
174,a giraffe standing on top of a grass covered field
175,a couple of giraffe standing next to each other
176,a herd of sheep standing on top of a dry grass field
177,a herd of sheep standing on top of a dry grass field
178,a group of horses standing in a field near a tree
179,a cat is looking out of a window
180,a car is driving down the road in front of a bus
181,a red train traveling down train tracks next to a forest
182,a stop sign is covered in snow in the snow
183,a red and yellow train at a train station
184,a stop sign with a sticker on it
185,a cat that is sitting on a red suitcase
186,a cat looking out a window at a bird
187,a red fire truck parked in a parking lot
188,a black and white photo of a group of people
189,a small white dog wearing a red tie
190,a close up of a broken piece of wood
191,a group of boats sitting on the sand
192,a couple of people standing next to each other
193,a couple of women walking down a street holding an umbrella
194,a cat that is laying down on a sink
195,a cat laying on top of a blanket on a couch
196,a man sitting in front of a laptop computer
197,a man standing next to a baby elephant
198,a dog catching a frisbee on a beach
199,a dog is playing with a toy in the snow
200,a close up of a black and white suit case
201,a woman standing in front of a luggage carousel
202,a dog with a frisbee in its mouth
203,a herd of zebra standing next to each other
204,a girl in a blue shirt is throwing a frisbee
205,a herd of zebra standing on top of a dirt field
206,a herd of zebra standing on top of a dry grass field
207,a zebra standing on top of a dirt field
208,a brown horse standing next to a forest
209,a statue of a man on a horse in front of a building
210,a close up of a person holding a sandwich
211,a man riding a wave on top of a surfboard
212,a person riding skis down a snow covered slope
213,a pile of oranges sitting on top of each other
214,a pile of oranges sitting on top of each other
215,a woman is skiing down a snowy path
216,a man swinging a baseball bat at a ball
217,a group of people standing next to each other
218,a man riding a skateboard down a sidewalk
219,a man riding skis down a snow covered slope
220,a man riding skis down a snow covered slope
221,a group of young boys standing next to a motorcycle
222,a green bowl filled with fruit and vegetables
223,a table topped with plates and bowls of food
224,a group of people standing on top of a snow covered slope
225,a man is eating a piece of cake
226,a man is doing a trick on a skateboard
227,a close up of a doughnut on a plate
228,a cup of coffee sitting on top of a wooden table
229,a plate with a banana on top of it
230,a piece of cake sitting on top of a white plate
231,a man laying on a bed with a cat
232,a bedroom with a bed and a shelf filled with books
233,a group of people sitting at a table with a cake
234,a woman is holding a box with a cake
235,a couple of women that are holding a cake
236,a couple of women that are holding a box
237,a man riding a wave on top of a surfboard
238,a group of people standing on a beach holding surfboards
239,a pizza sitting on top of a white plate
240,a man standing on a tennis court holding a racquet
241,a close up of a pizza on a plate
242,a person is holding a piece of pizza
243,a group of people sitting at a table eating pizza
244,a man is playing tennis on a blue court
245,a living room filled with furniture and a lamp
246,a couple of men standing next to each other
247,a young boy is playing a video game
248,a desk with two laptops and a desktop computer
249,a living room filled with furniture and a fire place
250,a person is flying a kite in a field
251,a group of people on a field playing baseball
252,a baseball player swinging a bat at a ball
253,a clock tower with a clock on top
254,a person laying on a bed with a blanket
255,a laptop computer sitting on top of a table
256,a person holding a cell phone in their hand
257,a person holding a cell phone in their hands
258,a woman putting a pizza into an oven
259,a little girl is brushing her teeth with a blow dryer
260,a close up of a plate of food on a table
261,a young girl holding a teddy bear next to a young girl
262,a woman sitting at a table with a plate of food
263,a kitchen with a microwave oven and a microwave
264,a laptop computer sitting on top of a wooden table
265,a kitchen with a refrigerator and a stove
266,a bathroom with a toilet and a sink
267,a bathroom with a toilet and a sink
268,a bathroom with a tub toilet and sink
269,a bathroom with a tub and a sink
270,a bathroom with a toilet and a sink
271,a black cat is sitting in a kitchen sink
272,a dog sitting in the back of a car
273,a city street filled with lots of traffic
274,a bathroom with a toilet and a shower
275,a white toilet sitting next to a white sink
276,a cat drinking water out of a toilet
277,a black and white cat sitting on a green chair
278,a close up of a bunch of oranges on a table
279,a small airplane flying through a blue sky
280,a flock of birds sitting on top of a tree
281,a group of birds flying in the sky
282,a close up of a giraffe with trees in the background
283,a large jetliner flying over a city with tall buildings
284,a large jetliner flying over a tall building
285,a giraffe standing next to a body of water
286,a city street with traffic lights and street signs
287,a wooden bench sitting on the side of a road
288,a traffic light sitting on the side of a road
289,a herd of sheep standing on top of a lush green field
290,a young girl petting a sheep in a field
291,a bird flying over a lush green forest
292,a man sitting on a boat in the water
293,a man riding on the back of a brown horse
294,a man sitting on a bench in front of a building
295,a blue and white train traveling down train tracks
296,a couple of birds sitting on a wire
297,a bird that is standing in a cage
298,a close up of a blue and white shirt
299,a woman in a wedding dress and a hat
